lat;lon;date_msg;address;inf_detail;vid
54.157387;27.835237;05.12.2018;Силичи;проведение ТСУ;0
54.122558;31.096788;05.12.2018;Дрибин, Улица Ленина, дом 37;Дежурство по обеспечению пожарной безопасности при проведении культурно-массовых мероприятий  Цирковое представление;5
53.089406;29.232966;05.12.2018;г. Бобруйск, Улица Силикатная, дом 1;ТСЗ;0
53.169638;29.168921;05.12.2018;г. Бобруйск, Улица Гагарина, дом 46;ПАСП;0
52.753412;25.150295;05.12.2018;Коссово, Улица 3 Февраля, дом 12А;Ликвидация последствий розлива ЛВЖ;0
52.820148;25.709857;05.12.2018;Добромысль, Улица Брестская, дом 9;Тушение пожаров в электо установках;0
52.502847;25.911056;05.12.2018;Гортоль, Улица Колхозная, дом 1;Тушение пожаров в здании ПАСП;0
53.948934;27.419905;05.12.2018;Ждановичи;показательные выступления;0
54.849292;29.156520;05.12.2018;Чашники, Улица Советская, дом 74;ТСП;0
53.988587;27.799498;05.12.2018;Королев Стан;проверка ППВ;0
53.132623;26.044857;05.12.2018;Русино, Улица Школьная, дом 25;ТСЗ.;0
53.327517;26.006629;05.12.2018;Городище, Улица Рымши, дом 4;Отработка норматива б/р № 2.;0
54.371381;29.168049;05.12.2018;Худовцы, Улица Магистральная, дом 2;занятие на огневой полосе психофизической подготовки.;0
53.175832;29.205443;05.12.2018;г. Бобруйск, Улица Минская, дом 142а;ТСЗ;0
53.673985;30.681442;05.12.2018;Волковичи, Улица Центральная, дом 26;Занятие боевое развертывание схема №13;0
53.978023;30.803499;05.12.2018;Сластены, Улица Центральная, дом 20;Боевое развертывание схема №13;0
53.815222;31.081119;05.12.2018;Староселы;Уборка аварийных деревьев;0
53.194533;26.159741;05.12.2018;Крошин, Улица Советская, дом 22;Отработка норматива б/р № 2.;0
53.140242;25.737759;05.12.2018;Полонка, Улица Щербакова, дом 46;Отработка норматива б/р № 6.;0
53.146164;29.231206;05.12.2018;г. Бобруйск, Улица Социалистическая, дом 126, кв.53;открывание двери;0
52.577427;25.380210;05.12.2018;Ходаки, Улица Михнюка, дом 44;ТСЗ;0
54.418832;27.834598;05.12.2018;Плещеницы, Улица В.И.Ленина, дом 1;проведение ТСЗ в АСВ;0
54.046217;30.825055;05.12.2018;Коровчино;Занятия ПАСП б/р № 14;0
53.182617;29.206451;05.12.2018;г. Бобруйск, Шоссе Минское, дом 4;ТСЗ;0
54.009404;31.194490;05.12.2018;Рясно;Занятия ПАСП б/р № 14;0
52.879589;25.497904;05.12.2018;Бытень, Улица Комсомольская, дом 2;упр.;0
52.709019;25.318032;05.12.2018;Ивацевичи, Улица М.Танка, дом 15;Подвоз воды , заказчик УП Брестское СПМК-2 , договор №584 от 29.11.2 18 г.;0
53.187316;29.211058;05.12.2018;г. Бобруйск, Улица Энергетиков, дом 7;ПАСП;0
53.169638;29.168921;05.12.2018;г. Бобруйск, Улица Гагарина, дом 46;ПАСП;0
53.187316;29.211058;05.12.2018;г. Бобруйск, Улица Энергетиков, дом 7;ПАСП;0
53.128246;29.178718;05.12.2018;г. Бобруйск, Улица Орловского, дом 9;ТСЗ;0
53.150887;29.224279;05.12.2018;г. Бобруйск, Улица Октябрьская, дом 159;ТСЗ;0
52.526465;25.842197;05.12.2018;Телеханы, Улица Якуба Коласа, дом 1;Занятия ГСВ;0
54.371381;29.168049;05.12.2018;Худовцы, Улица Магистральная, дом 2;Занятие на огневой полосе психофизической подготовки.;0
53.950705;27.786994;05.12.2018;Колодищи, Улица Школьная;ТСЗ;0
53.822498;27.455530;05.12.2018;Щомыслица, Улица Жуковского;ТСЗ;0
54.000614;27.276841;05.12.2018;Заславль, Улица Советская, дом 93;ТСЗ;0
52.505893;25.557767;05.12.2018;Оброво, Улица Молодёжная, дом 11;упр.;0
52.820148;25.709857;05.12.2018;Добромысль, Улица Брестская, дом 9;упр.;0
54.486741;29.152854;05.12.2018;Прошика, Улица Молодёжная, дом 1;НБР № 3;0
53.811201;27.658210;05.12.2018;Новый Двор;ТСЗ;0
51.745621;23.596787;05.12.2018;Домачево;Н-1;0
52.028011;23.813285;05.12.2018;Мухавец;БР-15;0
51.557628;23.601669;05.12.2018;Томашовка;БР-14;0
54.067531;27.696292;05.12.2018;Острошицкий Городок;ТСЗ;0
52.502847;25.911056;05.12.2018;Гортоль, Улица Колхозная, дом 1;упр.;0
52.203911;23.681502;05.12.2018;Вистычи;БР-15А.;0
53.705986;28.413142;05.12.2018;Червень, Улица Ленинская, дом 47;Занятия в теплодымокамере.;0
55.817858;28.797521;05.12.2018;Селявщина;ТО-1.;0
53.758123;27.845801;05.12.2018;Ксаверово;ТСЗ;0
53.226945;27.359571;05.12.2018;Комсомольская, Улица Школьная, дом 3;Занятия ТСЗ;0
53.252643;27.184423;05.12.2018;Слобода-Кучинка, Улица Новая, дом 4;Занятия ТСЗ;0
53.147306;27.111050;05.12.2018;Копыль, Улица Тимковичская, дом 9;Занятия ТСЗ;0
53.338621;27.098091;05.12.2018;Песочное, Улица Ленина, дом 10;Занятия ТСЗ;0
52.996254;27.045272;05.12.2018;Мацкевичи, Улица Московская, дом 1;Занятия ТСЗ;0
53.177394;25.982335;05.12.2018;г. Барановичи, Улица Наконечникова, дом 29;Взаимодействие с ГАИ.;0
53.074393;29.290185;05.12.2018;Барак;В результате дорожно-транспортного происшествия в автомобиле «ВАЗ 21 5» оказался зажат погибший водитель, пассажирка покинула автомобиль самостоятельно, водитель и пассажирка автомобиля «Опель Астра» покинули автомобиль самостоятельно.;0
55.789316;28.594136;05.12.2018;Конюхово;Оказание помощи РОВД при ДТП;0
54.360266;29.116954;05.12.2018;Гапоновичи;По прибытию к месту вызова установлено, что произошло столкновение легкового автомобиля  Ситроен  гос. номер 8214 АК-5 2  1 г.в. с грузовым автомобилем  Скания  гос. номер Н719 КО РФ. Пострадавших нет. Помощь МЧС не требуеться.;0
